{
  "$schema": "../schema/security-findings-v1.schema.json",
  "version": "v1",
  "name": "security-findings-v1",
  "description": "Golden evaluation dataset of 50 hand-labeled security findings in a normalized SARIF/Semgrep-style contract. Used by evals/run_eval.py to measure severity-classification accuracy, ticket-action accuracy, and false-positive detection (precision/recall/F1).",
  "provenanceNote": "Clean-room. Every finding is synthetic and authored from PUBLIC standards only: SARIF (OASIS), Semgrep public rule output format, OWASP Top 10 (2021), and MITRE CWE. No proprietary code, rules, schemas, data, or credentials from any employer are used. Code snippets are illustrative pseudo-examples, not copied from any codebase.",
  "labeling": {
    "labeledBy": "maintainer",
    "method": "Each finding labeled by mapping its CWE/OWASP category to a senior-analyst severity assessment and the correct triage action, with an explicit rationale per record.",
    "severityScale": ["info", "low", "medium", "high", "critical"],
    "actions": {
      "create_ticket": "Real, actionable vulnerability — open a tracking ticket.",
      "suppress": "False positive or non-issue — suppress, do not ticket.",
      "escalate": "Genuinely ambiguous / trust boundary unclear — route to a human analyst."
    }
  },
  "fieldSpec": {
    "id": "Stable finding id (idempotency anchor).",
    "scanner": "Source scanner name (semgrep).",
    "ruleId": "Scanner rule identifier (public-standard style).",
    "title": "Short human title.",
    "message": "Scanner message describing the finding.",
    "file": "Relative path of the affected file.",
    "startLine": "Start line of the finding region.",
    "endLine": "End line of the finding region.",
    "codeSnippet": "Illustrative clean-room snippet of the flagged code.",
    "cwe": "MITRE CWE identifier.",
    "owasp": "OWASP Top 10 (2021) category, when applicable.",
    "scannerSeverity": "Native scanner severity (ERROR | WARNING | INFO; SARIF level error|warning|note).",
    "label": {
      "severity": "Ground-truth severity (severityScale).",
      "expectedAction": "Ground-truth triage action (create_ticket | suppress | escalate).",
      "isFalsePositive": "True when the scanner finding is not a real vulnerability.",
      "rationale": "Why this label was assigned."
    },
    "provenance": "Public standard(s) the labeling is grounded in."
  },
  "distribution": {
    "bySeverity": { "critical": 9, "high": 15, "medium": 12, "low": 6, "info": 8 },
    "byAction": { "create_ticket": 39, "suppress": 8, "escalate": 3 },
    "falsePositives": 8,
    "total": 50
  },
  "findings": [
    {
      "id": "F-001",
      "scanner": "semgrep",
      "ruleId": "python.lang.security.audit.formatted-sql-query.formatted-sql-query",
      "title": "SQL Injection via string-formatted query",
      "message": "Detected user-controlled input concatenated into a SQL statement. Use parameterized queries.",
      "file": "app/api/users.py",
      "startLine": 42,
      "endLine": 43,
      "codeSnippet": "query = \"SELECT * FROM users WHERE name = '\" + request.args['name'] + \"'\"\ncursor.execute(query)",
      "cwe": "CWE-89",
      "owasp": "A03:2021-Injection",
      "scannerSeverity": "ERROR",
      "label": { "severity": "critical", "expectedAction": "create_ticket", "isFalsePositive": false, "rationale": "Untrusted request input flows directly into a SQL string; classic injection with full data-exfiltration impact." },
      "provenance": "CWE-89; OWASP A03:2021 Injection"
    },
    {
      "id": "F-002",
      "scanner": "semgrep",
      "ruleId": "python.lang.security.audit.dangerous-subprocess-use.dangerous-subprocess-use",
      "title": "OS Command Injection via shell=True",
      "message": "subprocess called with shell=True and user input. This allows arbitrary command execution.",
      "file": "app/services/exporter.py",
      "startLine": 88,
      "endLine": 88,
      "codeSnippet": "subprocess.run(\"tar -czf backup.tgz \" + user_path, shell=True)",
      "cwe": "CWE-78",
      "owasp": "A03:2021-Injection",
      "scannerSeverity": "ERROR",
      "label": { "severity": "critical", "expectedAction": "create_ticket", "isFalsePositive": false, "rationale": "User-controlled path concatenated into a shell command with shell=True enables RCE." },
      "provenance": "CWE-78; OWASP A03:2021 Injection"
    },
    {
      "id": "F-003",
      "scanner": "semgrep",
      "ruleId": "python.lang.security.audit.eval-detected.eval-detected",
      "title": "Code Injection via eval() on user input",
      "message": "Detected eval() applied to user-controlled data. This is remote code execution.",
      "file": "app/api/calc.py",
      "startLine": 15,
      "endLine": 15,
      "codeSnippet": "result = eval(request.json['expression'])",
      "cwe": "CWE-94",
      "owasp": "A03:2021-Injection",
      "scannerSeverity": "ERROR",
      "label": { "severity": "critical", "expectedAction": "create_ticket", "isFalsePositive": false, "rationale": "eval() over request body is arbitrary Python execution." },
      "provenance": "CWE-94; OWASP A03:2021 Injection"
    },
    {
      "id": "F-004",
      "scanner": "semgrep",
      "ruleId": "python.lang.security.deserialization.pickle.avoid-pickle",
      "title": "Insecure Deserialization with pickle.loads",
      "message": "Detected pickle.loads on untrusted data. Deserialization can execute arbitrary code.",
      "file": "app/cache/session_store.py",
      "startLine": 60,
      "endLine": 60,
      "codeSnippet": "session = pickle.loads(request.cookies['session'])",
      "cwe": "CWE-502",
      "owasp": "A08:2021-Software and Data Integrity Failures",
      "scannerSeverity": "ERROR",
      "label": { "severity": "critical", "expectedAction": "create_ticket", "isFalsePositive": false, "rationale": "Deserializing attacker-controlled cookie data with pickle yields RCE." },
      "provenance": "CWE-502; OWASP A08:2021"
    },
    {
      "id": "F-005",
      "scanner": "semgrep",
      "ruleId": "javascript.browser.security.insecure-document-method.insecure-document-method",
      "title": "Stored XSS via innerHTML",
      "message": "User-controlled value assigned to innerHTML without sanitization.",
      "file": "web/src/components/Comment.js",
      "startLine": 24,
      "endLine": 24,
      "codeSnippet": "commentEl.innerHTML = comment.body;",
      "cwe": "CWE-79",
      "owasp": "A03:2021-Injection",
      "scannerSeverity": "ERROR",
      "label": { "severity": "critical", "expectedAction": "create_ticket", "isFalsePositive": false, "rationale": "Persisted user content rendered via innerHTML executes script in other users' browsers." },
      "provenance": "CWE-79; OWASP A03:2021 Injection"
    },
    {
      "id": "F-006",
      "scanner": "semgrep",
      "ruleId": "python.lang.security.audit.insecure-xml-parsing.insecure-xml-use",
      "title": "XML External Entity (XXE) injection",
      "message": "XML parser configured to resolve external entities on untrusted input.",
      "file": "app/api/import_xml.py",
      "startLine": 31,
      "endLine": 33,
      "codeSnippet": "parser = etree.XMLParser(resolve_entities=True)\ntree = etree.fromstring(request.data, parser)",
      "cwe": "CWE-611",
      "owasp": "A05:2021-Security Misconfiguration",
      "scannerSeverity": "ERROR",
      "label": { "severity": "critical", "expectedAction": "create_ticket", "isFalsePositive": false, "rationale": "Entity resolution on untrusted XML enables file disclosure and SSRF." },
      "provenance": "CWE-611; OWASP A05:2021"
    },
    {
      "id": "F-007",
      "scanner": "semgrep",
      "ruleId": "python.requests.security.ssrf.requests-ssrf",
      "title": "Server-Side Request Forgery (SSRF)",
      "message": "User-controlled URL passed to an outbound HTTP request without allow-listing.",
      "file": "app/api/fetch_url.py",
      "startLine": 19,
      "endLine": 19,
      "codeSnippet": "resp = requests.get(request.args['target'])",
      "cwe": "CWE-918",
      "owasp": "A10:2021-Server-Side Request Forgery (SSRF)",
      "scannerSeverity": "ERROR",
      "label": { "severity": "critical", "expectedAction": "create_ticket", "isFalsePositive": false, "rationale": "Unrestricted outbound fetch of a user URL can reach internal metadata/services." },
      "provenance": "CWE-918; OWASP A10:2021"
    },
    {
      "id": "F-008",
      "scanner": "semgrep",
      "ruleId": "python.lang.security.audit.path-traversal.path-traversal-open",
      "title": "Path Traversal in file read",
      "message": "User input concatenated into a filesystem path passed to open().",
      "file": "app/api/download.py",
      "startLine": 27,
      "endLine": 27,
      "codeSnippet": "with open('/var/data/' + request.args['file']) as f:",
      "cwe": "CWE-22",
      "owasp": "A01:2021-Broken Access Control",
      "scannerSeverity": "ERROR",
      "label": { "severity": "critical", "expectedAction": "create_ticket", "isFalsePositive": false, "rationale": "'../' sequences let an attacker read arbitrary files outside the data directory." },
      "provenance": "CWE-22; OWASP A01:2021"
    },
    {
      "id": "F-009",
      "scanner": "semgrep",
      "ruleId": "generic.secrets.security.detected-aws-secret-access-key.detected-aws-secret-access-key",
      "title": "Hardcoded AWS secret access key",
      "message": "A hardcoded AWS secret access key was detected in a production configuration file.",
      "file": "app/config/production.py",
      "startLine": 12,
      "endLine": 12,
      "codeSnippet": "AWS_SECRET_ACCESS_KEY = \"wJalrXUtnFEMI/K7MDENG/bPxRfiCYEXAMPLEKEY\"",
      "cwe": "CWE-798",
      "owasp": "A07:2021-Identification and Authentication Failures",
      "scannerSeverity": "ERROR",